{"operation":"assert","authority":"ledger-cli","summary":"Admit lrn-20260727T032727Z-e3769968 for Phase 2 consideration.","scope":{"kind":"repo","repo":"owner/repo","paths":[]},"source_refs":[{"kind":"learning","ref":".ledger/learnings/events.jsonl#lrn-20260727T032727Z-e3769968","summary":"Canonical learning row"}],"related_ids":[],"supersedes_id":null,"payload":{"learning_id":"lrn-20260727T032727Z-e3769968","learning_status":"codify_now","repo":"owner/repo","source_path":".ledger/learnings/events.jsonl","decision_delta":"When closing a source-memory workflow, prefer an explicit checkpoint because it binds evidence freshness.","evidence_snapshot":["command: zig build test passed"],"future_behavior":"Run the checkpoint after the delivery handoff.","verification":"Re-check the canonical row and evidence snapshot before applying this learning.","tags":["memory_admission"],"canonical_fingerprint":"e37699684e53cf80"}}
